{
  "schema": "biggz-ai.review-reconcile/v1",
  "lineage_id": "lineage-reconcile-001",
  "project": "acme",
  "chain_valid": true,
  "topics": [
    {
      "topic": "sdd/lineage-reconcile-001/review/transaction",
      "status": "current"
    },
    {
      "topic": "sdd/lineage-reconcile-001/review/ledger",
      "status": "current"
    },
    {
      "topic": "sdd/lineage-reconcile-001/review/receipt",
      "status": "stale",
      "detail": "content differs from native state"
    },
    {
      "topic": "sdd/lineage-reconcile-001/review/gate-context",
      "status": "missing"
    }
  ],
  "refreshed": 1,
  "wrote": true
}
